{
  "reviewVersion": "1.0.0",
  "familyId": "clean-raster-bpmn",
  "canary": "reviewer-only-canary-81cfc2834fedfb3c",
  "authoredIndependentlyOfCandidate": true,
  "assertions": [
    {
      "id": "clean-raster-bpmn.assertion.1",
      "claim": "valid and invalid branches reach different destinations",
      "disposition": "required",
      "severity": "critical",
      "dimension": "evidenceFidelity",
      "epistemicStatus": "established",
      "evidence": [
        {
          "sourceId": "clean-raster-bpmn.source.1",
          "locator": "gateway and arrows",
          "stance": "supports",
          "effectiveDate": null,
          "entityScope": "legacy model owner",
          "caseScope": "Clean raster invoice BPMN"
        }
      ],
      "outputLocations": [
        "BPMN semantics",
        "SVG preview",
        "Quality Report",
        "final delivery claims"
      ],
      "evaluation": {
        "kind": "agent",
        "instructions": "Inspect the cited source and externally observable candidate artifacts; do not infer from candidate plausibility."
      }
    },
    {
      "id": "clean-raster-bpmn.assertion.2",
      "claim": "a raster image contains an editable BPMN source",
      "disposition": "forbidden",
      "severity": "critical",
      "dimension": "coverage",
      "epistemicStatus": "unknown",
      "evidence": [
        {
          "sourceId": "clean-raster-bpmn.source.1",
          "locator": "container format",
          "stance": "does-not-support",
          "effectiveDate": null,
          "entityScope": "legacy model owner",
          "caseScope": "Clean raster invoice BPMN"
        }
      ],
      "outputLocations": [
        "BPMN semantics",
        "SVG preview",
        "Quality Report",
        "final delivery claims"
      ],
      "evaluation": {
        "kind": "agent",
        "instructions": "Inspect the cited source and externally observable candidate artifacts; do not infer from candidate plausibility."
      }
    }
  ],
  "variantAssertions": [],
  "reviewRubric": {
    "version": "1.0.0",
    "criteria": [
      {
        "id": "comprehension",
        "question": "Can a reviewer identify ownership, branching, and completion without author assistance?",
        "scale": [
          "clear",
          "partly clear",
          "unclear"
        ],
        "citationRequired": true
      },
      {
        "id": "ambiguity",
        "question": "Are material unknowns and competing interpretations visible rather than silently resolved?",
        "scale": [
          "explicit",
          "partly explicit",
          "hidden"
        ],
        "citationRequired": true
      },
      {
        "id": "correction-effort",
        "question": "How much measured reviewer effort was required to reach an acceptable correction?",
        "scale": [
          "no correction",
          "minor correction",
          "major correction",
          "not measured"
        ],
        "citationRequired": true
      }
    ]
  },
  "acceptableAlternatives": [
    "Any BPMN topology is acceptable when it preserves every assertion and does not add forbidden meaning."
  ],
  "observedResults": []
}
